,short_text
1042,World Heritage Irrigation Structure tag for four sites in India
1043,"Rajnath, Shah, Tomar arrive at Nadda's residence to discuss farmers' protests"
1044,"David was angry at Varun but vented on me, that was bit of an issue: Sara"
1045,"Anushka does shirshasana during pregnancy with Kohli's support, shares throwback pic"
1046,Kim Jong-un vaccinated against COVID-19; China supplied vaccine: Analyst
1047,My little boy has asked me to wake him up whenever Kohli comes to bat: Vaughan
1048,"Honeybee swarms land on two flights at Kolkata airport, pics surface"
1049,Case filed after policeman attacked with sword amid farmers' protest
1050,Centre-allotted labs taking over 24 hrs to give reports: Delhi Minister
1051,India had largest reductions in malaria cases in SE Asia in 20 yrs: WHO
1052,Farmers use tractor to remove barricades at Delhi-UP border
1053,"UK and Canada MPs support farmer protests in India, criticise govt"
1054,TV journalist arrested for sexually assaulting 13-yr-old girl in Chennai
1055,Unilever to test 4-day working week in New Zealand at full pay
1056,I felt this is my kind of human being: Gauahar on fiancé Zaid
1057,Remo D'Souza reveals late Saroj Khan wanted him to make her biopic
1058,"I try to be a hands-on father, but it's complicated: Aamir Ali"
1059,"I do some films for money, so that I can do good cinema for free: Siddiqui"
1060,Completely opposed to racism: Cavani apologises for racist post
1061,Facebook buys customer service startup Kustomer for a reported $1 bn
1062,"Canada plans digital tax on tech majors like Facebook, Google"
1063,"AQI in Noida stays in 'very poor' category, parts of Ghaziabad 'severe'"
1064,TRS MLA Nomula Narsimhaiah dies due to heart attack
1065,Village pradhan's son among 3 held in UP journalist death case
1066,2 booked under anti-conversion law for harassing UP man to leave his wife
1067,Azeri army enters last district given up by Armenia after ceasefire
1068,Opposition involved alongside Israel in scientist's killing: Iran official
1069,Deforestation surges to 12-year high in Brazil's Amazon rainforest 
1070,Himanshi shares Kangana's tweet on farmers' protest; reacts to her remarks
1071,Chrissy tweets about struggling to produce enough breast milk for her kids
1072,"India reports 31,118 new coronavirus cases, 482 more deaths"
1073,"Cricket Aus terrified of BCCI, breached contract for them: Channel 7"
1074,"Asaduddin Owaisi, G Kishan Reddy cast their votes for GHMC polls"
1075,"₹14L gold hidden in cream bottles, toy cars seized at Chennai airport"
1076,Voting begins for 2nd phase of Jammu and Kashmir's DDC elections
1077,"22-year-old held for rape, murder of 8-year-old cousin in Rajasthan"
1078,Bata appoints an Indian as CEO for the 1st time in 126-year history
1079,Which are the richest families in Asia according to Bloomberg?
1080,BJP planning to shift Bollywood from Mumbai to UP: Cong leader
1081,I know they're going to do something: Lindsay on 'Mean Girls' sequel
1082,I've been missing work: Sunny on resuming work post COVID-19 lockdown
1083,Father's pot of gold can't make you a star: Vikram on nepotism 
1084,New Year parties banned in S Korea amid rising COVID-19 cases
1085,140 million COVID-19 tests done in India in past 11 months: Govt
1086,Pak's Raza Hasan expelled from domestic cricket season for COVID-19 breach
1087,"Bitcoin is gold 2.0, will soar to $500,000: Winklevoss twins"
1088,Shah's promise to free Hyd from Nizami culture is gimmick: Nizam's kin
1089,Delhi's air quality deteriorates to 'very poor' category
1090,Singhu and Tikri borders closed for traffic due to farmers' protest
1091,"H'yana's Ambala records 'severe' AQI of 404, worst among 118 cities on Mon"
1092,RTGS payment system available 24x7 from today
1093,Woman held with banned drug worth over ₹50 lakh in Mumbai
1094,Salt of NDA: LJP leader says 'we expect representation in Union Cabinet'
1095,French govt drops draft bill to ban filming of police after protests
1096,"LVB interest rates, services to continue till further notice: DBS"
